{
  "schema_version": "1.0",
  "title": "VERA end-to-end evaluation checklist",
  "instructions": "Filter items by profile, execute every selected item, and report PASS, FAIL, BLOCKED, or NOT_APPLICABLE with evidence. A P0 failure blocks the run.",
  "items": [
    {
      "id": "PRE-001",
      "priority": "P0",
      "layer": "CROSS_CUTTING",
      "profiles": ["daily", "nightly", "weekly", "release"],
      "question": "Is the run manifest complete enough to reproduce and compare this run?",
      "evidence": ["git revision and dirty state", "dataset/checklist hashes", "redacted config fingerprint", "backend/model/cache/concurrency profile"],
      "pass_condition": "Every required manifest field in schemas/run.schema.json is recorded before execution.",
      "scenario_ids": []
    },
    {
      "id": "PRE-002",
      "priority": "P1",
      "layer": "CROSS_CUTTING",
      "profiles": ["nightly", "weekly", "release"],
      "question": "Is the accepted baseline compatible with this run?",
      "evidence": ["baseline manifest", "dimension-by-dimension compatibility diff"],
      "pass_condition": "Dataset, backend, models, cache state, concurrency, and quality-affecting config match, or the run is explicitly marked observation-only.",
      "scenario_ids": []
    },
    {
      "id": "PRE-003",
      "priority": "P0",
      "layer": "L7_RUNTIME",
      "profiles": ["daily", "nightly", "weekly", "release"],
      "question": "Are all mutating cases confined to a dedicated synthetic scope with bounded cost and cleanup?",
      "evidence": ["resolved scopes", "fixture prefix", "cost budget", "cleanup plan"],
      "pass_condition": "No production/user scope is writable and all generated resource IDs are unique to the run.",
      "scenario_ids": ["SEC-001", "PERF-001"]
    },
    {
      "id": "PRE-004",
      "priority": "P0",
      "layer": "CROSS_CUTTING",
      "profiles": ["daily", "nightly", "weekly", "release"],
      "question": "Were fixtures and expected values frozen before execution?",
      "evidence": ["dataset SHA-256", "scenario schema validation", "random seed"],
      "pass_condition": "Inputs and expected assertions are immutable for the duration of the run.",
      "scenario_ids": []
    },
    {
      "id": "OBS-001",
      "priority": "P0",
      "layer": "CROSS_CUTTING",
      "profiles": ["daily", "nightly", "weekly", "release"],
      "question": "Can every executed boundary join to its adjacent boundary, including answer and feedback references when those stages run?",
      "evidence": ["run/case/workflow/trace IDs", "artifact/chunk/extraction/assertion/fact/projection/context-pack/answer IDs", "join query or trace"],
      "pass_condition": "Every executed adjacent transition is connected by stable IDs, and the nightly/release set collectively covers source through answer and feedback; unavailable required stages are BLOCKED, not inferred.",
      "scenario_ids": ["E2E-001", "ANS-001", "LEARN-001", "PERF-001", "PERF-003"]
    },
    {
      "id": "OBS-002",
      "priority": "P1",
      "layer": "CROSS_CUTTING",
      "profiles": ["nightly", "weekly", "release"],
      "question": "Are all quality-affecting versions attached to evidence?",
      "evidence": ["ontology and pipeline versions", "extractor/prompt/model versions", "embedding and reranker versions", "weight-set version"],
      "pass_condition": "No semantic result lacks the versions required to reproduce it.",
      "scenario_ids": ["E2E-001", "LEARN-001", "PERF-001"]
    },
    {
      "id": "OBS-003",
      "priority": "P0",
      "layer": "CROSS_CUTTING",
      "profiles": ["daily", "nightly", "weekly", "release"],
      "question": "Are domain and system timestamps recorded separately?",
      "evidence": ["source_event_time", "observed_at", "recorded_at", "published_at", "searchable_at"],
      "pass_condition": "The run can calculate source lag, processing latency, queue latency, and time-to-searchable without substituting one timestamp for another.",
      "scenario_ids": ["E2E-001", "TEMP-001", "PERF-002"]
    },
    {
      "id": "OBS-004",
      "priority": "P0",
      "layer": "L7_RUNTIME",
      "profiles": ["daily", "nightly", "weekly", "release"],
      "question": "Are evaluation artifacts safe to retain?",
      "evidence": ["redaction scan", "secret scan", "pseudonymization and retention policy"],
      "pass_condition": "No credential, authorization header, secret, raw production payload, or direct personal identifier is stored.",
      "scenario_ids": []
    },
    {
      "id": "SRC-001",
      "priority": "P1",
      "layer": "L6_INGESTION",
      "profiles": ["nightly", "release"],
      "question": "Does incremental sync consume every page and checkpoint only completed work?",
      "evidence": ["cursor before/after", "has_more/page count", "fetched IDs", "retry state"],
      "pass_condition": "All fixture pages are processed once and the saved cursor never moves past a failed page.",
      "scenario_ids": ["ING-004"]
    },
    {
      "id": "SRC-002",
      "priority": "P0",
      "layer": "L6_INGESTION",
      "profiles": ["daily", "nightly", "release"],
      "question": "Is source event time preserved unchanged through the full lifecycle?",
      "evidence": ["connector record", "artifact version", "episode", "graph edge", "search result"],
      "pass_condition": "The source event instant is present and equal at every applicable boundary; ingestion time is separate.",
      "scenario_ids": ["TEMP-001", "TEMP-002"]
    },
    {
      "id": "SRC-003",
      "priority": "P1",
      "layer": "L6_INGESTION",
      "profiles": ["daily", "nightly", "release"],
      "question": "Can source sync account for fetched, changed, unchanged, deleted, failed, and quarantined records?",
      "evidence": ["sync event counters", "record-level reason codes"],
      "pass_condition": "Counters reconcile to fetched records and every non-success has a bounded reason code.",
      "scenario_ids": ["ING-001", "ING-005"]
    },
    {
      "id": "ING-001",
      "priority": "P0",
      "layer": "L6_INGESTION",
      "profiles": ["daily", "nightly", "release"],
      "question": "Is replaying an identical source record idempotent?",
      "evidence": ["artifact/chunk/assertion/evidence/fact/job counts before and after replay", "content hashes"],
      "pass_condition": "The second ingest creates no artifact version, chunk, assertion, evidence, fact, or projection job.",
      "scenario_ids": ["ING-001"]
    },
    {
      "id": "ING-002",
      "priority": "P0",
      "layer": "L6_INGESTION",
      "profiles": ["daily", "nightly", "release"],
      "question": "Does a body change create exactly one new artifact version?",
      "evidence": ["old/new body hashes", "artifact versions", "assertion/evidence/fact lineage"],
      "pass_condition": "One changed body produces one ordered version and no duplicate projection.",
      "scenario_ids": ["ING-006"]
    },
    {
      "id": "ING-003",
      "priority": "P0",
      "layer": "L6_INGESTION",
      "profiles": ["daily", "nightly", "release"],
      "question": "Does a semantic metadata-only change create a new version and update truth?",
      "evidence": ["canonical metadata hashes", "artifact versions", "old/new triples", "current search"],
      "pass_condition": "A changed structured triple with unchanged/empty body is processed exactly once and becomes current according to policy.",
      "scenario_ids": ["ING-002"]
    },
    {
      "id": "ING-004",
      "priority": "P0",
      "layer": "L6_INGESTION",
      "profiles": ["nightly", "release"],
      "question": "Does a record or page failure preserve retryability without advancing past lost data?",
      "evidence": ["injected failure", "cursor snapshots", "job outcome", "post-recovery record set"],
      "pass_condition": "After recovery all records are present once, failed work was retried, and no cursor skipped it.",
      "scenario_ids": ["ING-004", "RES-001"]
    },
    {
      "id": "ING-005",
      "priority": "P1",
      "layer": "L6_INGESTION",
      "profiles": ["nightly", "release"],
      "question": "Can raw artifacts be re-extracted after extractor or pipeline changes?",
      "evidence": ["initial zero-claim artifact", "stored raw object", "new extraction version", "new claims"],
      "pass_condition": "An artifact stored during extractor outage can be reprocessed without source mutation and yields versioned claims.",
      "scenario_ids": ["ING-003"]
    },
    {
      "id": "ING-006",
      "priority": "P1",
      "layer": "L6_INGESTION",
      "profiles": ["nightly", "release"],
      "question": "Do source deletions and removed relations leave the correct current view?",
      "evidence": ["source tombstone/delete event", "fact lifecycle event", "current and as-of search"],
      "pass_condition": "Deleted knowledge is absent from current search, follows retention policy historically, and does not silently remain current.",
      "scenario_ids": ["ING-005"]
    },
    {
      "id": "CUR-001",
      "priority": "P1",
      "layer": "L5_CURATION",
      "profiles": ["nightly", "release"],
      "question": "Does extraction meet precision, recall, yield, and schema-validity baselines?",
      "evidence": ["labeled expected claims", "extracted claims", "per-slice confusion counts"],
      "pass_condition": "All extracted claims validate; baseline deltas activate only with at least 100 labeled records and a compatible accepted baseline.",
      "scenario_ids": ["CUR-003"]
    },
    {
      "id": "CUR-002",
      "priority": "P1",
      "layer": "L5_CURATION",
      "profiles": ["nightly", "release"],
      "question": "Are entity and predicate normalization stable across paraphrases, case, aliases, and languages?",
      "evidence": ["normalized claim pairs", "canonical entity IDs", "dedup decisions"],